{
  "version": 1,
  "id": "p0-2-super-admin-user-management-compatibility",
  "title": "P0.2 Super Admin User-Management Compatibility Certification",
  "feature_type": "maintenance",
  "owner": "fair-crm",
  "platform_reusability": "existing_core_capability",
  "trigger": "none",
  "tenant_scope": "mixed",
  "user_facing": true,
  "affected_paths": [
    "frontend/src/api/userManagement.compatibility.test.ts",
    "frontend/src/auth/UsersAdminCompatibility.test.ts"
  ],
  "permissions": {
    "required": false,
    "reason": "This phase certifies the existing Core-authoritative user-management contract and introduces no permission or assignment path.",
    "items": []
  },
  "frontend": {
    "required": true,
    "routes": [
      "/admin/system/users"
    ],
    "menu": false,
    "menu_permission": null
  },
  "applicability": {
    "database": { "status": "na", "reason": "Certification-only change; no FAIR CRM or Core persistence changes." },
    "migration": { "status": "na", "reason": "No schema or permission-catalog change." },
    "permissions": { "status": "na", "reason": "Existing user-management permissions and Core authorization remain unchanged." },
    "backend": { "status": "na", "reason": "No FAIR CRM backend runtime changes; manual provisioning continues directly through the existing Core API client." },
    "api": { "status": "na", "reason": "No endpoint or payload contract is added or changed." },
    "tenant_isolation": { "status": "na", "reason": "No production organization-scoping logic changes; existing organization header and Core authorization behavior are only regression-locked." },
    "audit": { "status": "na", "reason": "No new mutation or audit event is introduced." },
    "frontend": { "status": "required" },
    "ui_permissions": { "status": "na", "reason": "The existing UI permission and can_manage_super_admin gates are unchanged and are certified structurally." },
    "menu": { "status": "na", "reason": "No navigation entry changes." },
    "route_guard": { "status": "na", "reason": "The existing /admin/system/users guard is unchanged." },
    "forms": { "status": "na", "reason": "The existing manual create form is unchanged; tests certify that the required password field and conditional Super Admin control remain present." },
    "visual_qa": { "status": "required" },
    "backend_tests": { "status": "na", "reason": "Core manual-create behavior was already covered by the completed Core certification; this PR adds FAIR CRM compatibility regression coverage only." },
    "frontend_tests": { "status": "required" },
    "runtime_authorization": { "status": "na", "reason": "No production authorization path changes; Core remains authoritative for role and Super Admin assignment." },
    "runtime_verification": { "status": "required" },
    "deployment": { "status": "na", "reason": "Test/contract-only certification; no runtime artifact changes." }
  },
  "notes": "Certifies the user-facing /admin/system/users compatibility surface without changing its runtime behavior: existing operator-driven manual create remains, administrator-supplied password remains required, transport stays on Core /organizations/{organization_id}/users/manual, Super Admin controls remain gated by Core can_manage_super_admin, and no setup-link mode is added before a Core setup-token contract exists. UI governance provides the visual regression gate for the unchanged surface."
}
