{
  "version": 1,
  "id": "run-history-delete-permission-consistency",
  "title": "Run History Delete Permission Consistency",
  "feature_type": "ui_only",
  "owner": "fair-crm",
  "platform_reusability": "existing_core_capability",
  "trigger": "user",
  "tenant_scope": "organization",
  "user_facing": true,
  "affected_paths": [
    "frontend/src/pages/ScraperRunHistoryPage.tsx",
    "frontend/src/permissions/ScraperRunHistoryDeletePermissions.test.ts",
    ".kyrox/features/run-history-delete-permission-consistency.json"
  ],
  "permissions": {
    "required": true,
    "items": [
      {
        "code": "fair_crm.scraper.delete",
        "action": "delete scraper run history records",
        "scope": "organization",
        "assignable": true
      }
    ]
  },
  "frontend": {
    "required": true,
    "routes": ["/data-integration/run-history"],
    "menu": false,
    "menu_permission": null
  },
  "applicability": {
    "database": { "status": "na", "reason": "No persistence changes are introduced." },
    "migration": { "status": "na", "reason": "The existing fair_crm.scraper.delete permission is reused." },
    "permissions": { "status": "required" },
    "backend": { "status": "na", "reason": "Existing run-history delete authorization remains unchanged and authoritative." },
    "api": { "status": "na", "reason": "No server API contract changes." },
    "tenant_isolation": { "status": "na", "reason": "No organization-scoping behavior changes." },
    "audit": { "status": "na", "reason": "Existing deletion behavior is unchanged." },
    "frontend": { "status": "required" },
    "ui_permissions": { "status": "required" },
    "menu": { "status": "na", "reason": "No navigation menu changes are introduced." },
    "route_guard": { "status": "na", "reason": "Run history remains readable; only delete requires delete permission." },
    "forms": { "status": "na", "reason": "No forms are changed." },
    "visual_qa": { "status": "required" },
    "backend_tests": { "status": "na", "reason": "Backend authorization behavior is unchanged." },
    "frontend_tests": { "status": "required" },
    "runtime_authorization": { "status": "required" },
    "runtime_verification": { "status": "required" },
    "deployment": { "status": "required" }
  },
  "notes": "Run history previously exposed delete to read-only users. Backend DELETE /scraper/runs/{run_id} requires fair_crm.scraper.delete; the UI now hides delete controls and fails closed without delete permission."
}
