{
  "version": 1,
  "id": "fair-stand-catalog-admin",
  "title": "Fair Stand catalog and catalog preview Super Admin CRUD",
  "feature_type": "system_admin",
  "owner": "fair-crm",
  "platform_reusability": "product_specific",
  "trigger": "user",
  "tenant_scope": "system",
  "user_facing": true,
  "affected_paths": [
    "frontend/src/api/fairStandAdmin.ts",
    "backend/alembic/versions/0085_fair_stand_catalog_previews.py",
    "backend/alembic/versions/0086_fair_stand_category_integer_id.py",
    "backend/alembic/versions/0087_fair_stand_preview_integer_id.py",
    "frontend/src/pages/FairStandCatalogAdminPage.tsx",
    "frontend/src/pages/FairStandCatalogAdminPage.test.ts",
    "frontend/src/pages/FairStandUnitsAdminPage.tsx",
    "frontend/src/pages/FairStandUnitsAdminPage.test.ts",
    "frontend/src/pages/FairStandPreviewsAdminPage.tsx",
    "frontend/src/pages/FairStandPreviewsAdminPage.test.ts",
    "frontend/src/pages/FairStandPage.test.ts",
    "frontend/src/pages/FairStandStandaloneRoute.test.ts",
    "frontend/src/components/admin/AdminSystemLayout.tsx",
    "frontend/src/permissions/navigationPermissions.ts",
    "frontend/src/permissions/fairStandAdminPermissions.ts",
    "frontend/src/permissions/corePermissions.ts",
    "scripts/fair_crm_role_matrix.py",
    ".kyrox/features/fair-stand-catalog-admin.json"
  ],
  "permissions": {
    "required": true,
    "items": [
      { "code": "fair_crm.admin.fair_stand.catalog", "action": "read", "scope": "system", "assignable": false },
      { "code": "fair_crm.admin.fair_stand.catalog.read", "action": "read", "scope": "system", "assignable": false },
      { "code": "fair_crm.admin.fair_stand.catalog.create", "action": "create", "scope": "system", "assignable": false },
      { "code": "fair_crm.admin.fair_stand.catalog.update", "action": "update", "scope": "system", "assignable": false },
      { "code": "fair_crm.admin.fair_stand.catalog.archive", "action": "archive", "scope": "system", "assignable": false }
    ]
  },
  "frontend": {
    "required": true,
    "routes": ["/admin/fair-stand/catalog", "/admin/fair-stand/previews", "/admin/fair-stand/units"],
    "menu": true,
    "menu_permission": "fair_crm.admin.fair_stand.catalog.read"
  },
  "applicability": {
    "database": { "status": "na", "reason": "Admin UI does not own catalog tables; live schema is Fair Stand DB." },
    "migration": { "status": "na", "reason": "CRM 0089 drop is covered by fair-stand-independent-catalog-host / item-catalog contracts." },
    "permissions": { "status": "required" },
    "backend": { "status": "na", "reason": "Admin mutations run on the Fair Stand API behind same-origin proxy." },
    "api": { "status": "na", "reason": "CRM no longer mounts /api/v1/fair-stand admin routes." },
    "tenant_isolation": { "status": "na", "reason": "Global Fair Stand product data; no organization_id; SYSTEM Super Admin only." },
    "audit": { "status": "na", "reason": "No new Fair CRM audit stream; mutations are Super Admin catalog administration." },
    "frontend": { "status": "required" },
    "ui_permissions": { "status": "required" },
    "menu": { "status": "required" },
    "route_guard": { "status": "required" },
    "forms": { "status": "required" },
    "visual_qa": { "status": "required" },
    "backend_tests": { "status": "na", "reason": "Admin API tests live in the Fair Stand repository; CRM asserts the routes are not hosted." },
    "frontend_tests": { "status": "required" },
    "runtime_authorization": { "status": "required" },
    "runtime_verification": { "status": "required" },
    "deployment": { "status": "required" }
  },
  "notes": "Domain remains Fair Stand. CRM Admin React pages call same-origin /api/v1/fair-stand/admin which Vite/Nginx proxy to the Fair Stand process. SYSTEM unassignable permissions are enforced by Stand using Core JWT. Catalog preview administration uses fair_crm.admin.fair_stand.catalog.*; the former previews.* permission codes are removed."
}
